[
  {
    "mapping_id": "vol8-roadmap-map-001",
    "phase": "Vol.8 Phase 8.4 - Feedback-to-Roadmap Product Boundary Mapping",
    "source_feedback_id": "vol8-feedback-001",
    "source_feedback_title": "Static boundary banner needs stronger placement",
    "mapping_category": "operator_trust_guardrail",
    "boundary_decision": "safe_to_refine_now_static_only",
    "mapped_summary": "Treat the boundary banner concern as an operator trust guardrail for static shell review materials.",
    "allowed_current_action": "Refine static documentation and handoff wording that repeats the local/static/read-only/fixture-only/no-network/no-execution boundary.",
    "disallowed_current_action": "Do not add live status indicators, execution controls, runtime checks, API calls, or customer-facing UI.",
    "requires_future_gate": false,
    "future_gate_type": "none",
    "affected_artifacts": ["static_shell/ldd/SAFETY_BOUNDARY.md", "docs/runtime/VOL8_STATIC_SHELL_QA_HANDOFF_CHECKLIST_v0.1.md"],
    "roadmap_only": false,
    "customer_facing_allowed": false,
    "network_or_api_allowed": false,
    "execution_or_mutation_allowed": false,
    "credential_or_auth_allowed": false,
    "recommended_next_action": "Keep boundary placement visible in static handoff materials.",
    "status": "safe_static_refinement"
  },
  {
    "mapping_id": "vol8-roadmap-map-002",
    "phase": "Vol.8 Phase 8.4 - Feedback-to-Roadmap Product Boundary Mapping",
    "source_feedback_id": "vol8-feedback-002",
    "source_feedback_title": "Panel hierarchy can be easier to scan",
    "mapping_category": "static_doc_refinement",
    "boundary_decision": "safe_to_refine_now_static_only",
    "mapped_summary": "Map scan-order feedback to static documentation refinement for the operator walkthrough.",
    "allowed_current_action": "Clarify panel scan order in static documentation and reviewer guidance.",
    "disallowed_current_action": "Do not create a production UI, frontend framework, live dashboard, or hosted app.",
    "requires_future_gate": false,
    "future_gate_type": "none",
    "affected_artifacts": ["static_shell/ldd/README.md", "static_shell/ldd/OPERATOR_WALKTHROUGH.md"],
    "roadmap_only": false,
    "customer_facing_allowed": false,
    "network_or_api_allowed": false,
    "execution_or_mutation_allowed": false,
    "credential_or_auth_allowed": false,
    "recommended_next_action": "Carry the scan-order note into the next static documentation pass.",
    "status": "safe_static_refinement"
  },
  {
    "mapping_id": "vol8-roadmap-map-003",
    "phase": "Vol.8 Phase 8.4 - Feedback-to-Roadmap Product Boundary Mapping",
    "source_feedback_id": "vol8-feedback-003",
    "source_feedback_title": "Fixture timestamp context is missing",
    "mapping_category": "static_fixture_refinement",
    "boundary_decision": "safe_to_refine_now_static_only",
    "mapped_summary": "Map timestamp context feedback to fixture explanation so static dates cannot be mistaken for live freshness.",
    "allowed_current_action": "Add static fixture notes that distinguish fixture timestamps from live market data freshness.",
    "disallowed_current_action": "Do not connect live market data, call APIs, or add a freshness polling mechanism.",
    "requires_future_gate": false,
    "future_gate_type": "none",
    "affected_artifacts": ["static_shell/ldd/static_shell_data.js", "static_shell/ldd/README.md"],
    "roadmap_only": false,
    "customer_facing_allowed": false,
    "network_or_api_allowed": false,
    "execution_or_mutation_allowed": false,
    "credential_or_auth_allowed": false,
    "recommended_next_action": "Add fixture timestamp language during a future static fixture refinement phase.",
    "status": "safe_static_refinement"
  },
  {
    "mapping_id": "vol8-roadmap-map-004",
    "phase": "Vol.8 Phase 8.4 - Feedback-to-Roadmap Product Boundary Mapping",
    "source_feedback_id": "vol8-feedback-004",
    "source_feedback_title": "Terminology differs between QA checklist and framework index",
    "mapping_category": "terminology_alignment",
    "boundary_decision": "safe_to_refine_now_static_only",
    "mapped_summary": "Map terminology drift to static wording alignment across QA, handoff, and framework-index materials.",
    "allowed_current_action": "Normalize static-shell QA terms in committed documentation and generated summaries.",
    "disallowed_current_action": "Do not expand terminology into new implemented product capabilities.",
    "requires_future_gate": false,
    "future_gate_type": "none",
    "affected_artifacts": ["docs/runtime/VOL8_STATIC_SHELL_QA_HANDOFF_CHECKLIST_v0.1.md", "docs/runtime/IMPLEMENTED_FUNCTION_FRAMEWORK_INDEX_v0.1.md"],
    "roadmap_only": false,
    "customer_facing_allowed": false,
    "network_or_api_allowed": false,
    "execution_or_mutation_allowed": false,
    "credential_or_auth_allowed": false,
    "recommended_next_action": "Use the Phase 8.4 mapping terms as the static planning vocabulary.",
    "status": "safe_static_refinement"
  },
  {
    "mapping_id": "vol8-roadmap-map-005",
    "phase": "Vol.8 Phase 8.4 - Feedback-to-Roadmap Product Boundary Mapping",
    "source_feedback_id": "vol8-feedback-004",
    "source_feedback_title": "Terminology differs between QA checklist and framework index",
    "mapping_category": "implemented_framework_index_update",
    "boundary_decision": "safe_to_refine_now_static_only",
    "mapped_summary": "Map framework-index wording feedback to repo-backed index maintenance.",
    "allowed_current_action": "Update implemented framework index metadata only when backed by committed docs, schemas, fixtures, records, or validators.",
    "disallowed_current_action": "Do not list speculative future ideas as implemented frameworks.",
    "requires_future_gate": false,
    "future_gate_type": "none",
    "affected_artifacts": ["docs/runtime/IMPLEMENTED_FUNCTION_FRAMEWORK_INDEX_v0.1.md", "mock_consumers/ldd/implemented_function_framework_index.json"],
    "roadmap_only": false,
    "customer_facing_allowed": false,
    "network_or_api_allowed": false,
    "execution_or_mutation_allowed": false,
    "credential_or_auth_allowed": false,
    "recommended_next_action": "Keep framework index updates tied to committed artifacts and validation.",
    "status": "safe_static_refinement"
  },
  {
    "mapping_id": "vol8-roadmap-map-006",
    "phase": "Vol.8 Phase 8.4 - Feedback-to-Roadmap Product Boundary Mapping",
    "source_feedback_id": "vol8-feedback-001",
    "source_feedback_title": "Static boundary banner needs stronger placement",
    "mapping_category": "qa_checklist_refinement",
    "boundary_decision": "safe_to_refine_now_static_only",
    "mapped_summary": "Map the boundary banner issue to a QA checklist reminder for local static review.",
    "allowed_current_action": "Add or refine checklist language that prompts reviewers to confirm boundary clarity.",
    "disallowed_current_action": "Do not add runtime tests, browser automation against hosted targets, or network checks.",
    "requires_future_gate": false,
    "future_gate_type": "none",
    "affected_artifacts": ["docs/runtime/VOL8_STATIC_SHELL_QA_HANDOFF_CHECKLIST_v0.1.md"],
    "roadmap_only": false,
    "customer_facing_allowed": false,
    "network_or_api_allowed": false,
    "execution_or_mutation_allowed": false,
    "credential_or_auth_allowed": false,
    "recommended_next_action": "Carry this into a future static-only checklist refinement.",
    "status": "safe_static_refinement"
  },
  {
    "mapping_id": "vol8-roadmap-map-007",
    "phase": "Vol.8 Phase 8.4 - Feedback-to-Roadmap Product Boundary Mapping",
    "source_feedback_id": "vol8-feedback-005",
    "source_feedback_title": "Roadmap candidate for saved feedback history",
    "mapping_category": "future_product_candidate",
    "boundary_decision": "roadmap_only_no_implementation",
    "mapped_summary": "Treat saved feedback history as a future product candidate only.",
    "allowed_current_action": "Record the candidate in roadmap planning language without implementation claims.",
    "disallowed_current_action": "Do not build a saved history UI, database, API, scheduler, or persistence layer.",
    "requires_future_gate": false,
    "future_gate_type": "none",
    "affected_artifacts": ["docs/runtime/VOL8_LOCAL_OPERATOR_FEEDBACK_REVIEW_GUIDE_v0.1.md", "docs/runtime/VOL8_FEEDBACK_TO_ROADMAP_MAPPING_GUIDE_v0.1.md"],
    "roadmap_only": true,
    "customer_facing_allowed": false,
    "network_or_api_allowed": false,
    "execution_or_mutation_allowed": false,
    "credential_or_auth_allowed": false,
    "recommended_next_action": "Keep as roadmap-only input for future product boundary study.",
    "status": "roadmap_only"
  },
  {
    "mapping_id": "vol8-roadmap-map-008",
    "phase": "Vol.8 Phase 8.4 - Feedback-to-Roadmap Product Boundary Mapping",
    "source_feedback_id": "vol8-feedback-005",
    "source_feedback_title": "Roadmap candidate for saved feedback history",
    "mapping_category": "future_readiness_gate_required",
    "boundary_decision": "requires_future_readiness_gate",
    "mapped_summary": "If saved feedback history ever moves beyond roadmap language, it must pass a future implementation readiness gate.",
    "allowed_current_action": "Name the future gate requirement in static planning notes.",
    "disallowed_current_action": "Do not implement persistence, user accounts, auth, mutation, or customer-facing surfaces.",
    "requires_future_gate": true,
    "future_gate_type": "implementation_readiness_gate",
    "affected_artifacts": ["docs/runtime/VOL8_FEEDBACK_TO_ROADMAP_BOUNDARY_MAP_v0.1.md"],
    "roadmap_only": true,
    "customer_facing_allowed": false,
    "network_or_api_allowed": false,
    "execution_or_mutation_allowed": false,
    "credential_or_auth_allowed": false,
    "recommended_next_action": "Preserve the gate requirement for a later readiness ladder phase.",
    "status": "requires_future_gate"
  },
  {